Id,Code,Name,Address,City,State,Zip,Phone,Email
183,cuxqp-8622-69759,Tina's Prevent Bedroom Remodeling,474 Aspen Drv,Louisville,Colorado,81082,513-074-7195,
184,ajnde-2227-5587,Haley's AAdrien Swing and Used Car Sales,1011 Galigher Station,Duluth,Minnesota,55577,219-588-5343,
185,3159-pcg-736,Balin's ZZima  Copy and Agriculture & Forestry and Wildlife Extermination and Pest Control,1748 Graylock Way,Terre Haute,Indiana,47382,423-259-6907,Helena.Balin@agriculture&forestryandwildlifeexterminationandpestcontrol.co.uk
186,tulkr-2861-70147,Cotton's Select User Towing,1636 Harding Road,Nashville,Tennessee,37879,405-141-9700,
187,cuth-294-856,Monica's Dedicate Tension Lawn care Services,540 Royma Boulevard,Columbus,Mississippi,39204,,lawncareservices@Monicatension.us
188,ujo-518-178,Shirley's Arrest Revenue Pharmacy,1214 Tannehill Road,Clifton,Colorado,81427,,Lydia.Shirley@revenuepharmacy.org
189,34373-pqiwg-850,Gamgee's Improve SScarlet Car Rental,889 Salem Blvd,Westbrook,Maine,4086,406-873-9072,Andrea.Gamgee@carrental.co.uk
190,seesh-737-4778,Halbarad's Tradition Attach and Remodeling,1330 Eastfield Place,Oswego,New York,12483,,
191,93755-imjew-8545,Treebeard's Shirt Question and Beauty Salon,1086 Wayne Ave,Hilton Head Island,South Carolina,29133,,beautysalon@Treebeardshirt.org
192,itwc-6697-47908,Joyce's Select AAshen  Tax Preparation,972 Prison Avenue,East Brainerd,Tennessee,38142,209-910-7390,
193,xnk-6994-457,Earendil's AAnnalle Dedicate and NPO,842 Dana Path,Newport Beach,California,92809,505-519-8404,
194,2028-cup-317,Heidi's Topic Understand and Collection Agency,1122 Military Station,,Oregon,97365,,Stephanie.Heidi@topiccollectionagency64.biz
195,hltk-312-7788,Oakenshield's IIlta Judge and Oil and Gas Distribution,986 Galbraith Station,Papillion,Nebraska,68761,339-762-9409,
196,ejh-457-70099,Dianna's Assumption Gasp and Cigarette Manufacturing,573 Nottingham Path,Lincoln,Nebraska,69221,401-666-6352,Liv.Dianna@assumptioncigarettemanufacturing.net
197,6828-vsn-695,Orome's Convince Throat Funeral Director,1733 Jensen Trail,Cranston,Rhode Island,2895,319-014-7999,Claudia.Orome@throatfuneraldirector.us
198,ohmp-286-8166,Wormtongue's Tension Gasp and Bail Bonds,579 Sundale Avenue,Urbandale,Iowa,50151,201-074-8115,Katrina.Wormtongue@tensionbailbonds.biz
199,41248-ppi-166,Kimberly's Confess AAshen  Telemarketing,515 Falt Rd,Bixby,Oklahoma,73772,339-661-4335,Lauren.Kimberly@telemarketing.net
200,3541-etcz-122,Jennifer's Farmer Develop and Catering,1740 Wallwork Run,Papillion,Nebraska,68431,859-250-0790,catering@Jenniferfarmer.us
201,orro-3147-8150,Wormtongue's Insert LLuna Beauty Salon,713 Leon Avenue,Valley Station,Kentucky,42765,401-612-2667,beautysalon@Wormtongue.net
202,qie-9454-86639,Isildur's Target LLaw Vocational Rehabilitation,1510 Ferncliff Ridge,Warwick,Rhode Island,2904,702-494-8239,Margaret.Isildur@vocationalrehabilitation.co.uk
203,cpfh-567-90449,Ann's Question LLillith  NPO,510 Kelly Parkway,,North Dakota,58501,480-362-7137,npo@Ann.biz
204,rspsb-8273-854,Ungoliant's Confess Desk Mortgage Company,1394 Michigan Lane,Peoria,Arizona,85006,225-421-0381,Albert.Ungoliant@deskmortgagecompany.biz
205,367-deuce-142,Denise's Disease Receive and Personal Assistant,609 Agines Place,Terrytown,Louisiana,71067,423-986-7604,Dennis.Denise@diseasepersonalassistant.us
206,olmq-414-9620,Sandyman's Swing YYello Vocational Rehabilitation,1716 Pike Station,Morristown,Tennessee,38577,339-823-2656,Nancy.Sandyman@vocationalrehabilitation.co.uk
207,kjtu-562-998,Sandyman's QQuistis G Confess and Nail Salon,657 Plantation Rd,Columbus,Nebraska,68382,,Emma.Sandyman@nailsalon.us
208,lmys-3804-955,Lurtz's MMorrin C Protect and Credit Union,680 Berkley Ave,Ojus,Florida,34712,505-826-8143,Carolina.Lurtz@creditunion.org
209,dceiz-6346-1858,Dorothy's Test Poetry Taxi,565 College Square,,Oregon,97377,405-800-1216,taxi@Dorothypoetry.org
210,1266-hlbmb-2715,Orome's Salad Prevent and Child and Youth Services,492 Vroom Park,Pascagoula,Mississippi,39455,,childandyouthservices@Oromesalad.net
211,95974-ehjp-3688,Mablung's Fancy Hospital Speech and Occupational Therapy,904 Cannon Court,Starkville,Mississippi,39182,513-536-9846,Allison.Mablung@hospitalhospital.us
212,ysneo-475-3272,Brooke's Swing AAnnalle Child and Youth Services,738 Missouri Way,Saint Paul,Minnesota,55590,262-306-6934,childandyouthservices@Brooke.biz
213,gdcq-5140-949,Elwing's Arrest Secretary Sports Agency,1358 Henry Park,La Crosse,Wisconsin,53293,385-714-8726,sportsagency@Elwingsecretary.net
214,960-sue-7513,Huan's Spring LLaw Truck Transportation,1174 Prame Run,Sandy City,Utah,84056,,Matthew.Huan@trucktransportation54.co.uk
215,sec-1230-526,Palantir's AAnnalle Twist and Electrolysis,421 Albert Terrace,Wahiaw+ä-ü,Hawaii,96756,513-595-7828,electrolysis@Palantir.org
216,241-xqosm-3421,Bombur's Confess Flight Home Health Services,649 Cementary Heights,Ramsey,Minnesota,55129,,homehealthservices@Bomburflight.com
217,436-tvcs-6999,Susan's Attach SSybi Athletic Training,773 Essex Circle,Bozeman,Montana,59083,,Eugene.Susan@athletictraining.net
218,lbe-2540-52547,Ulmo's Bedroom Question and Fitness Center,1069 Mackenzie Circle,Florence,South Carolina,29848,339-515-7034,fitnesscenter@Ulmobedroom.org
219,ukfk-1124-837,Ferny's Receive CCalami Locksmith,740 Mcmillan Trail,Papillion,Nebraska,68070,229-328-8272,Beverly.Ferny@locksmith.biz
220,259-pgjr-3464,Audrey's Travel Tennis Security Guard,515 Bateman Boulevard,Pooler,Georgia,30206,423-684-1458,Richard.Audrey@tennissecurityguard.org
221,zbv-1345-967,Iris's Chat YYao Creig Education Child Care Services,1559 Arthur Avenue,Gallatin,Tennessee,38045,339-995-4796,Mary.Iris@educationchildcareservices.net
222,chbr-1584-9823,Ellie's Brainstorm Outcome Emergency Medical Services,844 Emily Crescent,Kearney,Nebraska,69033,405-886-7228,emergencymedicalservices@Ellieoutcome.co.uk
223,fidaq-863-258,The White's SScarlet Benefit and Used Car Sales,856 Rock St,Ridgeland,Mississippi,39194,218-740-5066,Daniel.The White@usedcarsales.org
224,qabt-8035-514,Goldberry's Instruct SSybi Interior Design,1575 Stiver Place,East Concord,New Hampshire,3303,,Daniel.Goldberry@interiordesign.co.uk
225,31906-hma-6614,Randy's Desk Agree and Investing,967 Linwood Path,Shoreview,Minnesota,55785,304-358-7159,
226,izew-371-41996,Gabriel's Target AAsema GED Certification,944 Ambarassdor Trail,,West Virginia,24976,802-314-2902,gedcertification@Gabriel.org
227,svh-3154-1650,Cirdan's TThist Instruct and Equipment Rentals,1135 Kirk Heights,Colchester,Vermont,5051,,equipmentrentals@Cirdan.net
228,abbey-468-38874,Maggot's Desk Collect and Emergency Medical Transportation,1392 Holmes Ridge,,North Dakota,58466,802-159-6763,
229,edm-6644-30831,Sauron's Question Farmer Marketing and Advertising,654 Hanson Heights,Rutland,Vermont,5602,702-944-0005,marketingandadvertising@Sauronfarmer.com
230,cxq-741-92777,The White's GGene Weaken and Auto Dealership,1317 Dona Boulevard,,North Dakota,58216,605-834-7483,
231,8026-tha-4472,Stephanie's TThess Select and Land Surveying,1342 Ederer Ridge,Rapid City,South Dakota,57649,,Jenny.Stephanie@landsurveying.us
232,4077-hmok-421,Evie's RRoshia Chr Swing and Insurance,1700 Dana Trail,,New Mexico,87115,217-573-0882,Jack.Evie@insurance.us
233,buegp-3908-495,Goldberry's Slam Death Crop Production,533 Merlin Place,Homewood,Illinois,60037,405-941-5698,April.Goldberry@deathcropproduction.biz
234,5670-rcx-130,Jade's ZZillah Test and Private Investigator,1093 Hamline Path,Brandon,Mississippi,39476,802-559-6139,
235,bqbu-471-66741,Adrianna's EElza  Test and Tutoring Services,648 Rawson Drive,South Burlington,Vermont,5653,207-743-6538,tutoringservices@Adrianna.co.uk
236,thz-547-421,Wormtongue's Step GGene Private Investigator,539 Greenbriar Drive,West Scarborough,Maine,4490,308-600-1993,privateinvestigator@Wormtongue54.com
237,91382-txk-5613,Jackson's Disease Arrest and Security Guard,1184 Tannehill Place,Mint Hill,North Carolina,28312,307-799-7084,securityguard@Jacksondisease.co.uk
238,secb-727-8155,Frances's Uncle Copy and Telemarketing,1158 Stevy Drive,Laramie,Wyoming,82945,239-248-7254,telemarketing@Francesuncle.co.uk
239,egfj-7051-100,Anarion's Fund Engine GED Certification,1347 Lubring Avenue,Egypt Lake-Leto,Florida,34990,401-222-4175,gedcertification@Anarionengine.biz
240,zde-4978-6833,Anarion's Prevent PPandora  Employment Office,1499 Date Terrace,West Warwick,Rhode Island,2895,203-594-3294,Lexie.Anarion@employmentoffice.net
241,71269-klwh-276,Fili's AAgnes  Chat and Building Inspection,1489 Kingswood Blvd,Wilton,Connecticut,6857,276-024-6750,buildinginspection@Fili.com
242,65777-mzijd-613,Matthew's AAsema Understand and Home Health Services,1744 Elida Street,Fort Hunt,Virginia,24045,,
243,oaien-2813-9321,Janice's Attach RRoshia Chr Used Car Sales,1277 Macedonia Square,,New Mexico,88052,701-375-3357,
244,7072-xgjf-208,Sandyman's AArlin Gasp and Beauty Salon,1130 Beauty Run,Southgate,Michigan,49689,,Ana.Sandyman@beautysalon.biz
245,vms-2878-544,Mandos's Collection Question and Oil and Gas Distribution,1464 Hardy Court,Liberty,Missouri,64179,307-216-7324,oilandgasdistribution@Mandoscollection.com
246,fpjkl-501-70573,Ivy's Copy WWish  Tutoring Services,1146 Clarendon Avenue,Laramie,Wyoming,82430,303-311-7384,Sandra.Ivy@tutoringservices94.biz
247,8148-pcrri-3268,Oakenshield's Chat Bedroom Fitness Center,959 Helene Path,Littleton,Colorado,81428,207-404-7846,
248,6911-mtsij-3913,Ancalagon's AAsema Twist and Insurance,796 Wise Circle,Portland,Maine,4762,,Joy.Ancalagon@insurance.org
249,4930-oapph-6344,Abby's Profession Hurry and Education Child Care Services,1336 Duvall Rd,,North Dakota,58787,303-183-6510,Carolina.Abby@professioneducationchildcareservices.us
250,ctci-153-7095,April's Praise GGail Pa Real Estate Agency,1634 Alexis Trail,Cimarron Hills,Colorado,81290,406-234-8076,realestateagency@Aprilestate.biz
251,shw-434-1686,Ecthelion's Chat RRoshia Chr Used Car Sales,1003 Fleming Heights,Woodmere,New York,13736,480-712-6143,Anthony.Ecthelion@usedcarsales.net
252,42842-drf-3660,Adam's AArlin Prevent and Fitness Center,989 Penney Ln,Sun City,Arizona,86303,,Gary.Adam@fitnesscenter68.biz
253,rav-386-29101,Legolas's Judge Farmer Education Child Care Services,1060 Sheridan Blvd,Suitland,Maryland,21404,513-701-8709,Joyce.Legolas@farmereducationchildcareservices.co.uk
254,922-svz-307,Sulimo's SSable  Improve and Personal Assistant,590 Superior Road,Eagan,Minnesota,55345,480-066-3855,
255,rsaxi-373-2275,Ivy's GGail Pa Instruct and Tanning Salon,1405 Mailey Ln,Anthem,Arizona,85326,206-863-8662,tanningsalon@Ivy.org
256,937-bhiq-4896,Proudfoot's Improve Entertainment Publishing Services,566 London Blvd,Federal Way,Washington,98295,505-870-7720,publishingservices@Proudfootentertainment.org
257,zze-651-32451,Smeagol's Charity Strengthen and Residential Care Facility,1627 Depot Boulevard,,Oregon,97239,304-279-4184,Tina.Smeagol@charityresidentialcarefacility.co.uk
258,9241-xkg-3500,Lucy's Quote LLuce Naxx Private Investigator,1570 Commissioner Ave,,West Virginia,26147,808-316-4606,Niki.Lucy@privateinvestigator.biz
259,2841-pda-361,Heidi's Fund WWill Funeral Director,459 Hawkes Drive,Hilo,Hawaii,96707,201-563-6899,
260,9379-bfm-6338,Smeagol's Skill Instruct and Car Rental,1056 Frazeysburg Boulevard,Tahlequah,Oklahoma,73146,205-973-7928,Oliver.Smeagol@skillcarrental.org
261,70381-sfews-471,Pollando's MMorrin C Look and Chiropractic Office,1739 Hinman Path,Florence,Alabama,35979,316-713-1042,
262,szvj-8588-63040,Erestor's Step WWeiss M Sports Agency,705 Sevall Road,Shawnee,Kansas,66540,406-899-6947,Steven.Erestor@sportsagency.co.uk
263,856-curi-9306,Kili's Spring MMax M Grocery,917 Sunray Trail,Niagara Falls,New York,13062,,grocery@Kili.com
264,459-ibtep-7339,Elendil's Instruct Charity Personal Assistant,423 Mcfarland Crescent,Pittsburgh,Pennsylvania,15069,803-874-7420,Daniel.Elendil@charitypersonalassistant.biz
265,jjrwh-5732-7922,Turin's Chat Information Food and Hospitality,1160 Cornell Park,Anderson,South Carolina,29125,217-235-3111,foodandhospitality@Turininformation.co.uk
266,ttr-935-95812,Melian's LLaw Chat and Home Health Services,1575 Wedgewood Terrace,Geneva,Illinois,61334,480-644-3850,homehealthservices@Melian.net
267,rccqj-736-852,Feanor's EEternity Confess and Mental Health Services,419 Bailey Ridge,Surprise,Arizona,86441,505-922-1105,
268,31862-bgila-3389,Damrod's Praise Replacement Massage Therapy,755 Virginia Rd,,Oregon,97111,423-142-9450,massagetherapy@Damrodreplacement.biz
269,65412-exaif-515,Sharon's Look Flight Veterinary Medicine,797 Crow Avenue,Springfield,Tennessee,37111,201-390-7082,Justin.Sharon@flightveterinarymedicine.co.uk
270,wojfi-5623-39819,Illuvatar's MMargo Target and Credit Union,876 Sofin Way,Enid,Oklahoma,74071,229-999-0469,
271,had-6843-6070,Nesa's Gasp Charity Wholesale Drug Distribution,1408 Celina Drv,Rome,Georgia,31771,458-707-1321,Michelle.Nesa@charitywholesaledrugdistribution.us
272,335-ezfss-3036,Baggins's Weaken Engine Education Child Care Services,1613 Olive Station,Oakville,Missouri,65446,907-006-7263,Erik.Baggins@engineeducationchildcareservices.us
273,7650-drw-916,Stormcrow's Travel WWill Fishing and Hunting,1201 Clearey Drive,Badger,Alaska,99517,203-786-8077,
274,ltswp-367-5269,Daniel's Information Insert and Massage Therapy,1653 Sudbury Place,Branford,Connecticut,6896,,massagetherapy@Danielinformation.us
275,xyoo-647-408,Angelica's Beer Select and Radiology,1686 Pfeiffer Lane,West Albany,New York,14607,316-668-3038,radiology@Angelicabeer57.biz
276,15331-jfa-5009,Katie's Entertainment Collect and Child and Youth Services,1013 Ridgeland Circle,Olathe,Kansas,66087,262-865-1152,
277,liqx-5296-944,Aldarion's Prevent ZZillah Mortgage Company,967 Cowden Lane,South Milwaukee,Wisconsin,53259,,Wendy.Aldarion@mortgagecompany30.co.uk
278,apj-965-384,Ingwe's Desk Receive and Physical Therapy,1360 Rehl Heights,Clarksville,Indiana,46311,217-574-3989,physicaltherapy@Ingwedesk.com
279,pzmu-5449-38563,Lydia's Throat Arrest and Medical Office,876 Narrows Station,Harvey,Illinois,60407,,Anna.Lydia@throatmedicaloffice.biz
280,4694-wop-389,Daniel's AAshen  Pay and Lawn care Services,696 Monroe Drv,Fort Hunt,Virginia,23665,,lawncareservices@Daniel.org
281,kmkjc-858-16934,Betty's Strengthen LLillith  Investing,1317 Spruce Court,North Providence,Rhode Island,2823,,investing@Betty.us
282,apud-863-24178,Stormcrow's AAdrien Know and Wholesale Drug Distribution,1416 Lawson Boulevard,Mesquite,Nevada,89826,401-201-9032,wholesaledrugdistribution@Stormcrow.org
283,71493-tyzy-4616,Eva's Fancy WWish  Repair and Maintenance,1705 Bonifield Road,Bristol,Rhode Island,2908,480-949-3736,Zelda.Eva@repairandmaintenance.com
284,79064-nbgw-544,Charles's Precede Bath Travel Agency,555 Tupedo Terrace,Marana,Arizona,85741,276-288-1327,travelagency@Charlesbath.com
285,193-aqq-6961,Sharon's Slam Wood Travel Agency,1462 Mcclain Drive,Fort Hunt,Virginia,23670,803-968-4623,travelagency@Sharonwood.co.uk
286,sdsaw-697-924,Mandos's Look QQuistis G Bail Bonds,1612 Smithfield Heights,Greenville,South Carolina,29709,605-792-3500,
287,lxi-6322-78684,Jordan's Confess Media Hospital,1701 Front Boulevard,Brookings,South Dakota,57552,,hospital@Jordanmedia.com
288,265-ceqxd-9643,Olorin's Store Response Grocery,1012 Wheatland Crescent,Pacific Grove,California,94087,240-405-0083,Toki.Olorin@responsegrocery69.com
289,pgpzi-393-33426,Ronald's Improve Reputation Telemarketing,1455 Grandview Drive,Butte-Silver Bow (Balance),Montana,59337,401-973-9103,
290,qzndd-9492-63672,Stormcrow's Receive MMemory Ad Massage Therapy,1567 Hicks Place,North Kingstown,Rhode Island,2880,339-878-0532,massagetherapy@Stormcrow.org
291,65266-pww-425,Brandybuck's Improve MMargo Storage,775 Garner Drive,Lincoln,Nebraska,69127,319-216-8986,storage@Brandybuck.org
292,ygj-124-794,Elladan's Twist MMorrin C Tutoring Services,818 Hamburg Square,Des Moines,Iowa,51024,252-450-6607,
293,8645-tfn-207,Lilly's Benefit Philosophy Pharmacy,1177 Pierce Street,Burlington,Massachusetts,1718,401-476-6623,
294,1021-ibb-348,Kyle's Chat Reputation Lawn care Services,718 South Street,Coventry,Rhode Island,2860,208-611-4876,lawncareservices@Kylereputation.us
295,zsdwy-987-675,Elros's Hospital Understand and GED Certification,1404 Wortman Park,Idaho Falls,Idaho,83349,308-040-1084,gedcertification@Elroshospital.biz
296,fqwd-900-8617,Erestor's Chat TTwilight L Racetrack,1232 Edna Lane,Huntersville,North Carolina,28136,219-760-0115,
297,69703-ckqpl-863,Mithrandir's TThess Precede and Event Planning,925 Madison Heights,South Bend,Indiana,47041,405-842-9991,Richard.Mithrandir@eventplanning.com
298,915-tgr-5217,Melody's Quote Secretary Electrolysis,1778 Manning Blvd,Ridgeland,Mississippi,38617,203-811-1305,
299,yljv-5956-340,Bofur's Requirement Fancy and Veterinary Medicine,480 Arcadia Court,West Hartford,Connecticut,6067,,Jeffrey.Bofur@requirementveterinarymedicine.biz
300,915-egbfc-601,Denise's Response Copy and Property Management,1155 Zanesville Crescent,Burleson,Texas,77882,207-063-0133,propertymanagement@Deniseresponse.org
301,swd-553-86564,Janet's LLillith  Understand and Publishing Services,1332 Patch Avenue,Augusta,Maine,4216,907-260-8182,
302,6263-jwb-9298,Thranduil's Swing GGail Pa Record Business,1387 Stansberry Circle,Fairbanks,Alaska,99524,859-728-6310,
303,960-pvlha-4399,Legolas's Strengthen Weakness Janitorial and Cleaning Services,938 Nor-Bixbey Parkway,Florence,Kentucky,41076,,janitorialandcleaningservices@Legolasweakness.com
304,2945-blmtg-875,Gollum's Arrest GGene Cigarette Manufacturing,791 Armco Rd,Mustang,Oklahoma,73150,,Mark.Gollum@cigarettemanufacturing.com
305,27643-ljlyb-9755,Denethor's EElaine Sha Question and Pharmacy,1708 Keystone Crescent,Carbondale,Illinois,62660,,Alexander.Denethor@pharmacy.biz
306,6928-iezg-3460,Maeglin's Understand MMemory Ad Grocery,1308 Hardy Avenue,Eagle River,Alaska,99546,479-712-5808,grocery@Maeglin.co.uk
307,94168-psqas-8673,Mandos's LLillith  Weaken and Residential Care Facility,938 Orchard Lane,Rogers,Arkansas,72835,302-341-9881,Patricia.Mandos@residentialcarefacility.com
308,cpwt-600-272,Bombur's IIlta Understand and Telemarketing,1646 Lark Crescent,Newark,Delaware,19892,,telemarketing@Bombur.net
309,umdy-464-719,Sara's Benefit Hospital Building Inspection,958 Lander Way,Whitney,Nevada,89825,,buildinginspection@Sarahospital.co.uk
310,738-rmgi-3130,Alexander's Salad Travel and Bakery,1800 Kahler Trail,Murray,Utah,84533,231-623-9298,
311,sbyt-7518-901,Donald's Know HHazelmer Security System Services,977 Merlin Street,Pahrump,Nevada,89149,212-915-9032,securitysystemservices@Donald.com
312,emqmh-191-652,Gildor's Exceed Artisan Photography,1154 Dillon Station,South Laurel,Maryland,21524,385-971-6102,photography@Gildorartisan.com
313,fbam-8021-67444,Butterbur's Collection Quote and Construction,694 Wetsell Avenue,Payson,Utah,84758,802-839-5451,Kate.Butterbur@collectionconstruction.biz
314,fvwpi-9568-4143,Celebrimbor's Test ZZayne Cr Barber Shop,704 Stiver Trail,South Burlington,Vermont,5701,423-520-2115,barbershop@Celebrimbor.com
315,726-dpqao-8330,Brandybuck's Pay Skill Wholesale Drug Distribution,575 Sugartree Ridge,Johnson City,Tennessee,38002,225-297-8020,Judy.Brandybuck@skillwholesaledrugdistribution.biz
316,1534-dvof-147,Audrey's SSybi Pay and Concrete Manufacturing,1576 Harmon Square,Slidell,Louisiana,70601,201-794-0868,concretemanufacturing@Audrey.co.uk
317,1799-aaewa-2090,Adrianna's LLuna Step and Hotels,1250 Normandy Trail,Chickasha,Oklahoma,74842,208-507-5012,hotels@Adrianna93.com
318,1170-ock-385,Rose's Chat EElaine Sha Agriculture & Forestry and Wildlife Extermination and Pest Control,1108 Fairmont Drive,Lewiston,Idaho,83203,405-144-0860,Mason.Rose@agriculture&forestryandwildlifeexterminationandpestcontrol.us
319,kyd-5763-11375,Sydney's Chat Shirt Fishing and Hunting,801 Larry Circle,Madison,Mississippi,39645,808-106-5477,Rose.Sydney@shirtfishingandhunting.co.uk
320,qvwux-3813-89074,Willow's AArlin Precede and Chiropractic Office,1288 Cecil Avenue,Schofield Barracks,Hawaii,96780,907-549-1210,Sophie.Willow@chiropracticoffice.us
321,63436-ymmz-1339,Huan's Pay MMax M Massage and Day Spa,1667 Merlin Street,Eagle River,Alaska,99574,605-750-5275,
322,6395-lkrj-622,Vivianna's Target AArc Br Concrete Manufacturing,1143 Fairmount Court,Watertown,South Dakota,57325,,concretemanufacturing@Vivianna.org
323,vkf-9748-42365,Gamgee's GGene Decorate and Child and Youth Services,876 Stout Ln,Haslett,Michigan,49250,702-427-4471,Helen.Gamgee@childandyouthservices.net
324,vryq-2537-4091,Glorfindel's SSeraphim  Exceed and Casino,837 Chapman Path,,North Dakota,58201,319-840-4938,Theresa.Glorfindel@casino.org
325,2991-bjdv-7477,Denethor's Collect GGene Vocational School,1608 Rice Heights,Burlington,Iowa,50037,,vocationalschool@Denethor.com
326,lhkl-836-67086,Bolger's Bedroom Strengthen and Lawn care Services,445 Coshocton Ave,Sunrise Manor,Nevada,89713,423-321-7801,Oliver.Bolger@bedroomlawncareservices.net
327,ncm-6326-903,Autumn's LLuna Confess and Storage,1347 Colburn Drv,Maryville,Tennessee,37162,228-214-1409,
328,10744-wnj-2945,Shelob's Dedicate WWill Sports Agency,1726 Blue St,Pleasantville,New Jersey,8853,212-127-5593,Juliet.Shelob@sportsagency.biz
329,980-ush-4506,Celeborn's Quote PPandora  Bank,1661 Norris Ridge,Rosedale,Maryland,21278,303-056-5737,
330,hyr-575-62354,Bolger's YYello Release and Vocational Rehabilitation,1393 Pleasantville Circle,Englewood,Colorado,81223,,vocationalrehabilitation@Bolger.us
331,25318-kgyc-3627,Toki's Slam YYello Plumbing,1735 Lambert Drive,Westerly,Rhode Island,2908,406-214-2551,Angie.Toki@plumbing.com
332,6262-gjb-5658,Nienna's ZZima  Instruct and Lawn care Services,1693 Gomber Park,Brighton,New York,13411,201-989-1365,
333,95884-zdort-1795,Delilah's Select Opportunity Tax Preparation,1762 Thompson Crescent,McAlester,Oklahoma,74352,802-514-4745,Bobby.Delilah@opportunitytaxpreparation7.us
334,1350-pbxz-9268,Charles's AAsema Decorate and Technology Services,1200 Kahler Drv,Colchester,Vermont,5653,,
335,2919-qdh-8306,Maggot's GGail Pa Question and Tax Preparation,1441 Mckaig Path,Security-Widefield,Colorado,81240,314-811-2164,
336,hmzc-6461-53170,Elendil's Prevent Collection Sports Agency,1072 Pershing Place,,New Mexico,87531,225-509-1329,Harold.Elendil@collectionsportsagency.org
337,8529-jrhpt-3340,Annatar's EEldia M Praise and Drug Screening,787 Crock Blvd,Terrytown,Louisiana,70898,405-076-2731,Sophie.Annatar@drugscreening.biz
338,49107-rcu-976,Sauruman's Climate Arrest and Fishing and Hunting,1253 Babbs Boulevard,Southaven,Mississippi,39730,,fishingandhunting@Saurumanclimate.org
339,icor-815-61801,Averie's EElaine Sha Spring and Vocational School,504 Lectric Lane,Emporia,Kansas,66078,228-976-1688,vocationalschool@Averie.co.uk
340,75418-wbkc-840,Elrond's Protect RRoshia Chr Publishing Services,1521 Limestone Run,South Orange,New Jersey,8332,209-363-9388,publishingservices@Elrond.org
341,924-sfjb-564,Erestor's Reputation Spring and Vocational Rehabilitation,983 Woolper Path,Shafter,California,95020,339-756-8933,
342,923-pbv-3154,Halbarad's TThist Slam and Mental Health Services,1004 Gayla Crescent,Kearney,Nebraska,68038,215-682-4938,mentalhealthservices@Halbarad.org
343,mlxk-311-653,Alcarin's Idea Chat and Hospital,505 Hall Way,Hermitage,Pennsylvania,17018,304-845-5934,
344,91312-heir-7414,Marilyn's Quote EElphina Technical School,1337 Warwick Drive,,West Virginia,24857,304-816-4135,
345,69596-raq-7251,Makenzie's JJinx Agree and Florist,1484 Pfeifer Trail,,West Virginia,25152,,Kenneth.Makenzie@florist.us
346,832-tbs-455,Celebrimbor's EElaine Sha Chat and Trade School,1166 Doru Heights,Wilton,Connecticut,6282,401-155-8897,
347,575-wif-634,Sauron's Store Bedroom Speech and Occupational Therapy,449 Turner Court,Central Falls,Rhode Island,2887,,Ana.Sauron@bedroomspeechandoccupationaltherapy.com
348,gsfdr-457-130,Bethany's Chat AArlin Storage,1286 Rock Run,Tooele,Utah,84722,385-444-5885,Albert.Bethany@storage.org
349,igqr-258-7830,Kenneth's Develop ZZayne Cr Repair and Maintenance,1271 Auburn Parkway,American Fork,Utah,84751,229-722-6445,Savannah.Kenneth@repairandmaintenance.org
350,ecxn-913-927,Yvette's Opportunity Insert and Mental Health Services,1785 Johnstown Heights,Douglasville,Georgia,31082,,Jewel.Yvette@opportunitymentalhealthservices.com
351,dsc-8897-118,Sandra's Form WWish  NPO,476 Broadvue Station,Saint Andrews,South Carolina,29512,401-003-7814,Noah.Sandra@npo.com
352,9137-tzmg-699,Kathryn's Permission Strengthen and Chiropractic Office,720 Toni Street,Woonsocket,Rhode Island,2833,207-763-9078,chiropracticoffice@Kathrynpermission.biz
353,1408-lmk-620,Thingol's Replacement Question and Massage and Day Spa,1439 Palamino Rd,West Scarborough,Maine,4973,803-999-5589,
354,315-sqz-138,Jeremy's Confess AAsema Contracting,1208 Dunham Drive,Mauldin,South Carolina,29824,605-054-6067,Ronald.Jeremy@contracting.co.uk
355,gkb-9539-31560,Imrahil's Bedroom Step and Alcohol and Tobacco Sales,1017 Middle Path,Rapid City,South Dakota,57427,262-741-1132,Kai.Imrahil@bedroomalcoholandtobaccosales.com
356,lddaw-904-9389,Josie's YYello Suffer and Optometry,974 Sofin Run,Racine,Wisconsin,53206,218-845-9434,
357,3427-grzk-462,Steven's AAyda V Protect and Bank,419 Stillmeadow Ave,Laconia,New Hampshire,3853,802-217-7140,
358,rienn-8228-7076,Amrod's Copy TThess Livestock and Slaughtery,1183 Hewitt Circle,Rutland,Vermont,5345,302-648-0828,livestockandslaughtery@Amrod.com
359,gsar-2972-63242,Beregond's Diamond Improve and Oil and Gas Extraction and Production,1335 Tremont Place,Wilmington,Delaware,19955,209-142-6085,oilandgasextractionandproduction@Beregonddiamond.com
360,61095-aghu-802,Stormcrow's Receive AAshen  Tutoring Services,1705 Rider Run,Hayward,California,91523,240-558-6447,Carla.Stormcrow@tutoringservices.us
361,aaecs-168-557,Damrod's WWeiss M Improve and Real Estate Agency,1201 Marsha Park,Butte,Montana,59855,385-346-1079,realestateagency@Damrodestate.biz
