Id,Code,Name,Address,City,State,Zip,Phone,Email
0,9501-lwitt-1426,Tiffany's EEternity Swing and Bank,717 Mckeever Ln,Tillmans Corner,Alabama,36550,702-579-0345,bank@Tiffany.net
1,751-oqby-1262,Gloin's Quote AArc Br Building Inspection,631 Faircrest Run,,North Dakota,58257,203-327-1318,
2,hpk-559-504,Sylvia's Agree LLillith  Locksmith,996 Fairview Path,Wolcott,Connecticut,6150,,
3,1058-mpo-7030,Elendil's Confess EElphina Remodeling,1432 Garst Park,Springfield,Missouri,63012,,remodeling@Elendil.org
4,712-omagf-815,Quickbeam's Replacement Strengthen and Investing,714 Peachblow Run,Elizabethtown,Kentucky,40544,423-274-3314,Andrea.Quickbeam@replacementinvesting.org
5,voyc-9778-7954,Kili's Response Agree and Massage and Day Spa,1492 Robinwood Run,Cookeville,Tennessee,37777,218-819-2367,
6,ekuok-5321-848,Gandalf's Fancy GGriffin  Embalmer,1357 Scenic Heights,Concord,New Hampshire,3230,207-946-3133,
7,71915-oiqe-5640,Gloin's AAshen  Swing and Fitness Center,862 Galway Street,Westbrook,Maine,4091,,Jessica.Gloin@fitnesscenter.net
8,44197-tyivv-6221,Elladan's Engine Attach and Cash Advances,1146 Fleek Parkway,Eagle,Idaho,83860,252-722-4963,
9,fyif-843-836,Yvette's Serve Idea Record Business,1197 Nottingham Blvd,Braintree,Massachusetts,2601,385-531-7790,Lydia.Yvette@idearecordbusiness.biz
10,1841-jpmpa-6384,Pharazon's Dedicate WWill Specialty Meat,1446 Hazlett Heights,Payson,Utah,84091,304-517-2513,specialtymeat@Pharazon.net
11,xoiyi-7246-1009,Brandon's Quote Disease Truck Transportation,1204 Delwood Crescent,,West Virginia,25832,,trucktransportation@Brandondisease.us
12,frxxl-3537-6169,Nimrodel's Hurry TThist Remodeling,1269 Garrett Place,Gillette,Wyoming,82801,,
13,cgryg-813-9588,Yavanna's AAyda V Fund and Private Investigator,1389 Helpar Heights,,New Mexico,88032,203-915-4478,privateinvestigator@Yavanna35.us
14,ctj-675-3955,Stormcrow's Release Wood Remodeling,1348 Beard Court,Wilton,Connecticut,6065,240-869-5420,remodeling@Stormcrowwood.org
15,zabwy-3270-82448,Jose's Weaken Estate Residential Care Facility,1525 Goosecreek Terrace,Kalispell,Montana,59934,,residentialcarefacility@Joseestate.co.uk
16,409-uudp-8387,Faramir's Chat EEldia M Electrolysis,1549 Solida St,Monroe,Louisiana,71106,458-879-0563,Hope.Faramir@electrolysis.org
17,xyc-3698-556,Hurin's Judge Permission Insurance,1798 Mccarley Crescent,Raytown,Missouri,64649,262-017-0988,
18,wrsyl-5653-2738,Orodreth's Target AArlin Tanning Salon,1067 Leonardville Blvd,Wausau,Wisconsin,54488,205-686-3780,Justin.Orodreth@tanningsalon.net
19,731-lcm-449,Carla's ZZima  Convince and Crop Production,1139 Blue Blvd,Opelika,Alabama,36907,423-642-4991,
20,7338-wgg-5335,Nienna's Skill Form and Whiskey Manufacturing,1366 Evergreen Station,Johnson City,Tennessee,38042,,Sean.Nienna@skillwhiskeymanufacturing.org
21,86986-qkz-8026,Ungoliant's Release Media Technology Services,1560 Mcowens Road,Fuquay-Varina,North Carolina,27920,240-979-7043,Megan.Ungoliant@mediatechnologyservices.com
22,10261-eqj-326,The White's Judge Death Massage and Day Spa,1651 Imlay Ln,Kalispell,Montana,59107,239-225-3580,massageanddayspa@The Whitedeath.biz
23,daliq-2745-97375,Victoria's Chat Physics Collection Agency,733 Pearl Way,Poinciana,Florida,33018,859-582-4181,Ryan.Victoria@physicscollectionagency.co.uk
24,uzthj-5886-30311,Sage's Philosophy Know and Casino,1590 Butler Drv,Covington,Kentucky,41713,,
25,5832-gso-7324,Bolger's Collect Tension Crop Production,1411 Richmond Square,Manchester,Missouri,63767,859-739-8274,cropproduction@Bolgertension.com
26,60516-ukp-441,Orodreth's Requirement Convince and Residential Care Facility,860 Willow Rd,Bowling Green,Kentucky,41847,302-603-3236,Eleanor.Orodreth@requirementresidentialcarefacility.net
27,lstsm-5738-231,Logan's Twist Secretary Nail Salon,662 Creekview Circle,Dover,Delaware,19706,208-596-1963,Willie.Logan@secretarynailsalon.org
28,hlxz-201-10258,Logan's ZZima  Look and Home Health Services,1022 Gibbard Ridge,Caldwell,Idaho,83639,406-845-0493,homehealthservices@Logan.us
29,72843-vlw-1414,Gildor's Suffer Tradition Barber Shop,1667 Peachblow Path,Oceanside,New York,11742,802-421-0604,barbershop@Gildortradition.biz
30,irfmv-930-465,Rose's Wood Test and Equipment Rentals,1583 Arborwood Road,South Burlington,Vermont,5143,,equipmentrentals@Rosewood.net
31,170-yghvo-7915,Patricia's Quote Reality Personal Assistant,1120 Martin Ln,Beverly Cove,Massachusetts,2647,212-402-1780,Ann.Patricia@realitypersonalassistant.org
32,jefa-381-445,Smeagol's AAgnes  Look and Chiropractic Office,1498 Kimes Drv,Hyattsville,Maryland,20862,405-771-7924,chiropracticoffice@Smeagol.co.uk
33,zmzc-2740-46830,Oakenshield's GGene Hurry and Racetrack,1159 Hall Court,Greenwood,Mississippi,39114,209-150-6623,
34,40672-ylem-216,Brian's Desk Arrest and Pawn Brokers,1554 Jensen Boulevard,Chowchilla,California,92251,,Maria.Brian@deskpawnbrokers.co.uk
35,cmugi-372-57714,Mark's SSeraphim  Test and Architecture,1359 Mcdonald Ridge,Badger,Alaska,99929,228-486-4046,architecture@Mark.org
36,2514-pmabs-6091,Pollando's Outcome Twist and Storage,1800 Union Rd,Hopatcong Hills,New Jersey,7430,480-509-8761,
37,958-bwra-537,Vivianna's Brainstorm AAnnalle Contracting,930 Raiders Drive,Sierra Vista,Arizona,86042,405-147-1656,contracting@Vivianna.biz
38,emhuy-2515-3127,Miranda's Replacement Release and Equipment Rentals,973 Ruth Path,Starkville,Mississippi,39442,423-005-2344,equipmentrentals@Mirandareplacement.org
39,38570-leaij-4471,Morgoth's Arrest MMax M Wholesale Drug Distribution,1536 Cleve Road,East Ridge,Tennessee,37918,304-824-8625,Ralph.Morgoth@wholesaledrugdistribution.net
40,5372-opoe-647,Angela's Tension Spring and Trade School,717 Bloomfield Heights,,West Virginia,26253,217-685-0451,tradeschool@Angelatension.org
41,sfyqo-3297-3060,Barahir's Understand Weakness Hospital,748 Fleek Ln,East Saint Louis,Illinois,61422,218-948-1221,hospital@Barahirweakness.com
42,9554-ermhp-4811,Willow's Select Fortune Credit Union,1636 Kennedy Road,Concord,New Hampshire,3756,859-046-5309,
43,uxsmm-289-825,Yavanna's Understand Profession Nail Salon,932 Obetz Court,Shively,Kentucky,42372,303-546-5936,
44,xrb-8728-514,Lilly's JJinx Brainstorm and Landscape Services,1667 Lawn Avenue,Aurora,Colorado,81020,209-874-1081,
45,cic-349-4812,Ivy's YYello Receive and Cash Advances,1215 December Drive,Marina,California,94701,702-641-9781,cashadvances@Ivy.us
46,dvto-8519-1549,Bregolas's Skill Precede and Substance Abuse Services,994 Lacon Road,,North Dakota,58843,,Sarah.Bregolas@skillsubstanceabuseservices.biz
47,turo-3773-73683,Judith's Beer Fancy and Specialty Meat,509 Morgantown Parkway,,New Mexico,87052,,
48,ptiu-5193-59821,Christopher's Tension Impress and Home Health Services,663 Carl Lane,Las Vegas,Nevada,89703,701-083-7838,homehealthservices@Christophertension.co.uk
49,ulw-818-36660,Sharon's Prevent SSybi Cemetery,424 Willow Court,Birmingham,Michigan,49725,229-554-6711,cemetery@Sharon.us
50,75616-nxkb-985,Turin's Form SSeraphim  Casino,965 Sonora Lane,Peachtree City,Georgia,31795,,Brianna.Turin@casino.com
51,312-nlpx-2993,Bracegirdle's Death Copy and Construction and Utilities,589 Baird Park,,West Virginia,25667,479-445-6153,Christopher.Bracegirdle@deathconstructionandutilities.com
52,xlgv-4082-54749,Susan's Convince Farmer Landscape Services,749 Sandra St,Fayetteville,Arkansas,72433,228-223-1141,landscapeservices@Susanfarmer.us
53,930-jks-8631,April's Flight Step and Interior Design,815 Shinick Circle,Bridgeton,New Jersey,8218,702-074-3690,Brooke.April@flightinteriordesign.co.uk
54,zgdgf-8543-5168,Jacqueline's Release AAyda V Wholesale Drug Distribution,758 Coventry Station,,North Dakota,58311,201-878-5866,Abigail.Jacqueline@wholesaledrugdistribution.co.uk
55,555-xgu-854,Ori's Gasp Artisan NPO,1610 Francis Trail,Altus,Oklahoma,73802,,Makenzie.Ori@artisannpo.org
56,sgnk-3406-349,Kili's Exceed Salad Funeral Director,1608 Creedmoor Street,,North Dakota,58060,405-214-5259,funeraldirector@Kilisalad.org
57,901-zyhf-994,Julia's Target AAsema Cash Advances,1516 Highview Square,Starkville,Mississippi,39151,405-860-0231,cashadvances@Julia.us
58,fqm-669-678,Erestor's Question Wood Drug Screening,845 Hickory Court,Vicksburg,Mississippi,38622,303-019-0487,Makenzie.Erestor@wooddrugscreening.com
59,ofoa-748-79156,Camilla's IIlta Serve and Wholesale Drug Distribution,919 Belden St,Erie,Colorado,80723,513-536-1650,Megan.Camilla@wholesaledrugdistribution10.org
60,164-dwwln-6239,Maedhros's LLace Instruct and Home Health Services,1314 Lafayette Run,Bloomington,Minnesota,55008,319-799-2812,
61,607-srpwh-122,Finwe's EEldia M Attach and Speech and Occupational Therapy,1563 Price Ridge,Muscatine,Iowa,52807,,Justin.Finwe@speechandoccupationaltherapy.com
62,50011-xmcfk-1196,Beren's People Confess and Massage and Day Spa,553 Meadowbrook Way,Mitchell,South Dakota,57057,218-816-8670,
63,nom-3419-826,Chloe's Store EElza  Fishing and Hunting,1700 Aeryview Road,Keene,New Hampshire,3450,219-619-4537,Maria.Chloe@fishingandhunting.net
64,itvog-440-4123,Grahame's SSeraphim  Step and Storage,549 Donald Parkway,Vincennes,Indiana,47232,,storage@Grahame.biz
65,4132-gskqr-3866,Kili's Travel Media Barber Shop,648 Range Boulevard,Badger,Alaska,99630,479-287-4024,Veronica.Kili@mediabarbershop.co.uk
66,548-oftre-644,Justin's Strengthen HHazelmer Building Inspection,1355 Clarendon Road,North Little Rock,Arkansas,71731,479-277-1489,buildinginspection@Justin.com
67,2401-tdy-709,Olorin's IIlta Benefit and Security Guard,1224 Burlington Parkway,Springdale,Arkansas,72048,,
68,774-wkjz-856,The Grey's Twist Poetry Repair and Maintenance,443 Wilmington Avenue,Brandon,Mississippi,39121,405-892-9134,repairandmaintenance@The Greypoetry.org
69,diw-800-1062,Thingol's Select WWeiss M Employment Office,506 Baughman Trail,Clarksdale,Mississippi,38878,,
70,cfx-9223-754,Angelique's ZZillah Fancy and Technical School,1759 Darla St,Knoxville,Tennessee,37131,808-743-8146,
71,ezwz-668-161,Pollando's Release Entertainment Towing,1708 Beatty Ridge,Wahiaw+ä-ü,Hawaii,96810,319-658-8360,
72,jwxqi-8437-84433,Radagast's SSable  Insert and Electrolysis,1655 Bonsels Run,Davenport,Iowa,50543,458-785-6388,
73,2826-czt-6946,Maria's AAdrien Gasp and Contracting,723 Mead Drive,Warrensburg,Missouri,64661,513-861-3758,Jenny.Maria@contracting.us
74,3247-avuax-401,Barahir's Response Brainstorm and Crop Production,852 Sevall Ln,Coon Rapids,Minnesota,56325,207-664-2300,Victoria.Barahir@responsecropproduction.us
75,eqdj-182-388,Telchar's Spring CCalami Technology Services,669 College Rd,Saco,Maine,4616,,Kathryn.Telchar@technologyservices.co.uk
76,cpq-963-499,Huan's AAyda V Weaken and Accounting,1566 Turtle Station,Casas Adobes,Arizona,85738,212-468-2155,Theodore.Huan@accounting12.co.uk
77,28073-hhfet-254,Jamie's MMargo Copy and Tutoring Services,837 Narrows Parkway,Pasadena,Maryland,20816,859-938-6250,tutoringservices@Jamie12.net
78,772-kzlgl-146,Camilla's PPandora  Insert and Insurance,887 Lacon Blvd,Valley Station,Kentucky,40472,239-343-8014,
79,iit-411-478,Melian's Understand People Mortgage Company,1608 Burnell Run,Punta Gorda,Florida,33435,605-289-7566,mortgagecompany@Melianpeople.biz
80,10130-hvmvy-2760,Lori's MMorrin C Pay and Marketing and Advertising,1442 Euclid Park,Watertown,South Dakota,57738,808-066-6682,marketingandadvertising@Lori.us
81,48426-ounf-2443,Bofur's Skill Copy and Security Guard,838 Dryden Circle,Wahiaw+ä-ü,Hawaii,96847,,securityguard@Bofurskill.net
82,26576-qark-6433,Thorondor's EEternity Precede and Athletic Training,1669 Sealover Blvd,Newton,Kansas,67036,808-028-7501,athletictraining@Thorondor.biz
83,28025-bvkzn-428,Ungoliant's Brainstorm Beer Drug Screening,454 Fulbrook Parkway,+óGé¼-£Ewa Gentry,Hawaii,96811,,Gabriella.Ungoliant@beerdrugscreening.com
84,10393-hhvyg-4763,Jackson's Benefit AAshen  Oil and Gas Distribution,708 Eastwood Terrace,Fort Worth,Texas,78152,480-782-3271,
85,173-xtg-236,Jerry's GGene Hurry and Cemetery,647 Leslie Road,Tempe Junction,Arizona,85203,406-887-6317,Josie.Jerry@cemetery.com
86,225-zdr-478,Valaquenta's TThist Look and Residential Care Facility,1635 Beam Parkway,New City,New York,12050,,
87,vqytp-4043-8425,Jackson's Spring Wife Used Car Sales,1205 Norfield Way,,North Dakota,58771,316-270-3440,Gabriel.Jackson@wifeusedcarsales.com
88,vfqh-601-70722,Eugene's Agree Throat Bakery,732 Dawson Avenue,Junction City,Kansas,67857,276-802-0812,bakery@Eugenethroat.org
89,71600-xrqtj-5226,Liv's Judge LLace Marketing and Advertising,1304 Milton Circle,Fort Hunt,Virginia,22107,458-715-0315,Bethany.Liv@marketingandadvertising.org
90,837-lfv-8624,Telchar's LLillith  Precede and Oil and Gas Extraction and Production,1768 Towers Street,Cape Girardeau,Missouri,65049,205-645-5218,
91,13693-wwbos-817,Victoria's Question Weakness Trade School,1511 Albert Terrace,Troy,Alabama,36628,225-772-8184,Juliet.Victoria@weaknesstradeschool.us
92,kfo-596-6229,Megan's Praise Death Catering,816 Pinkley Court,Marrero,Louisiana,71363,605-229-9068,Daniel.Megan@deathcatering.com
93,3325-cybl-211,Lawrence's EEternity Slam and Electrolysis,1342 Grace Square,Brookings,South Dakota,57384,802-792-0979,Judy.Lawrence@electrolysis.biz
94,28496-zxp-798,Elijah's Spring Weakness Agriculture & Forestry and Wildlife Extermination and Pest Control,1722 Mary Circle,South Burlington,Vermont,5143,702-395-5275,Angela.Elijah@weaknessagriculture&forestryandwildlifeexterminationandpestcontrol.us
95,rqr-1893-148,Michelle's AAgnes  Know and Cemetery,1332 Hanawalt Heights,,North Dakota,58214,303-311-9325,cemetery@Michelle.co.uk
96,whlcx-7864-48825,Ruth's Bath Look and Home Inspection,692 Beulah Ave,Lakewood,Colorado,80301,,homeinspection@Ruthbath.net
97,pqs-585-61793,Huan's Test MMargo Security Guard,1592 Wilkins Avenue,Coralville,Iowa,51551,,securityguard@Huan.biz
98,efpo-4862-684,Veronica's WWill Insert and Tax Preparation,1397 Dowling Drv,Wyckoff,New Jersey,7978,458-769-5836,taxpreparation@Veronica.co.uk
99,48299-ipidj-8861,Bombadil's LLace Chat and Locksmith,1540 Elfin Street,Grandview,Missouri,65051,225-723-9628,
100,eeax-419-622,Lilly's Slam Desk Athletic Training,1467 Wheelabout Parkway,Gretna,Louisiana,71152,702-459-9308,
101,wsu-6060-63351,Sara's Gasp Tennis Specialty Seafood,1532 Chase Station,,North Dakota,58444,201-947-8472,specialtyseafood@Saratennis.net
102,eceua-5546-745,Mitch's Impress LLuna Catering,1636 Dyer Drive,Muskogee,Oklahoma,73155,304-683-3941,catering@Mitch.net
103,oqgas-519-633,Mithrandir's Test Salad Telemarketing,781 Camden Ln,,West Virginia,25989,316-453-2676,telemarketing@Mithrandirsalad.us
104,5906-jogl-204,Levi's ZZima  Benefit and Video Production,1121 Harrison St,Emporia,Kansas,67235,907-803-3783,videoproduction@Levi.us
105,77681-qqufb-4286,Miriel's Swing Tension Fishing and Hunting,546 Roper Trail,Badger,Alaska,99576,385-285-6263,
106,tfyup-7490-37727,John's Spring Entertainment Cash Advances,1387 Schuler Drive,Murray,Utah,84791,206-555-7479,cashadvances@Johnentertainment.com
107,qwa-352-7389,Wendy's Travel IIlta Radiology,1120 Stiers Parkway,Spokane,Washington,98330,,Sylvia.Wendy@radiology.biz
108,9608-pll-879,Thomas's Strengthen Idea Security System Services,1380 Yost Parkway,Rochester,New Hampshire,3815,,securitysystemservices@Thomasidea.biz
109,wanw-4761-21763,Cotton's Target Bath Land Surveying,1616 Obetz Boulevard,Waipahu,Hawaii,96762,605-407-7762,
110,mhx-547-390,Wayne's Reputation Attach and Cemetery,1579 Crosier Place,Mitchell,South Dakota,57346,,cemetery@Waynereputation.co.uk
111,curaa-5794-692,Niki's Outcome Target and Photography,944 Jessamine Place,Mauldin,South Carolina,29541,339-670-4667,Jenny.Niki@outcomephotography.net
112,732-yxs-636,Gerald's Throat Instruct and Cosmetology School,1530 Sharon Path,Hastings,Nebraska,68849,231-572-0474,Peter.Gerald@throatcosmetologyschool.us
113,728-klw-1304,Pollando's Spring AAshen  Interior Design,852 Codell Heights,Henderson,Nevada,89015,209-205-3529,Robert.Pollando@interiordesign.org
114,tgimd-509-404,Chloe's Copy Diamond Real Estate Agency,1057 Shoop Station,Diamond Bar,California,95631,,realestateagency@Chloediamond.biz
115,utz-451-146,Erika's Disease Gasp and Casino,1346 Martin Drive,Lansdale,Pennsylvania,16052,207-687-1511,casino@Erikadisease.com
116,902-kfwug-4903,Finwe's Question RRoshia Chr Florist,867 Chewelah Drv,Biddeford,Maine,4628,405-029-2937,florist@Finwe.org
117,5576-aluce-276,Justin's MMemory Ad Precede and Bookkeeping,1769 Eastview Trail,Vicksburg,Mississippi,38726,252-010-3262,bookkeeping@Justin.biz
118,95954-zksp-2140,Brianna's Throat Slam and Landscape Services,789 Axline St,Franklin,Massachusetts,2722,458-837-8519,
119,4025-qccy-572,Kili's Fancy LLillith  Vocational School,1752 Wolfe Lane,Maryland Heights,Missouri,64783,,Angela.Kili@vocationalschool.biz
120,okwph-7473-225,Daniella's Outcome Improve and Racetrack,501 Peachblow St,Wailuku,Hawaii,96717,505-105-8434,Scarlet.Daniella@outcomeracetrack.biz
121,84733-dbf-763,Norah's Gasp Engine Event Planning,816 Lafayette Lane,,Oregon,97920,,Benjamin.Norah@engineeventplanning.biz
122,nltfz-8207-970,Oakenshield's Convince Reputation Concrete Manufacturing,623 Villa Blvd,Madison Heights,Michigan,49064,701-683-7279,Sydney.Oakenshield@reputationconcretemanufacturing.co.uk
123,9136-khbq-6155,Annatar's Select Diamond Auto Dealership,942 Airport Drv,Jackson,Michigan,48347,210-230-6065,autodealership@Annatardiamond.co.uk
124,11595-vllwo-616,Orome's Climate Arrest and Tax Preparation,700 Blocksom Station,Cibolo,Texas,76483,252-288-8362,taxpreparation@Oromeclimate.co.uk
125,14508-dxmq-6699,Wormtongue's Insert PPandora  Interior Design,677 Lark Run,Danvers,Massachusetts,1090,,interiordesign@Wormtongue.com
126,cxxha-351-4922,Donna's GGriffin  Question and Racetrack,1317 Lucasburg Way,Newton,Iowa,50675,808-457-9978,racetrack@Donna.com
127,cfgm-9240-7928,Gamgee's YYello Gasp and Alcohol and Tobacco Sales,1132 Restless Boulevard,Kailua,Hawaii,96754,,Carla.Gamgee@alcoholandtobaccosales.com
128,vdp-9093-5969,Miranda's Swing AAsema Construction,602 Tupedo Park,Whitney,Nevada,89428,316-673-4221,Benjamin.Miranda@construction.co.uk
129,97916-ergts-846,Larissa's LLaw Gasp and Medical Office,503 Orders Path,Liberal,Kansas,67581,240-407-1453,medicaloffice@Larissa.net
130,3181-xyu-894,Fingolfin's WWill Decorate and Property Management,1329 Freedom Rd,Great Falls,Montana,59756,701-561-8770,Sarah.Fingolfin@propertymanagement.us
131,jixo-822-29153,Carol's SSybi Decorate and Casino,1615 Crossgate Way,Kentwood,Michigan,48255,405-763-0628,Barbara.Carol@casino2.biz
132,vsf-4993-512,Theoden's Brainstorm LLuce Naxx Fishing and Hunting,1524 Pershing St,Olive Branch,Mississippi,39754,701-445-0478,fishingandhunting@Theoden20.us
133,xror-827-3942,Arthur's LLillith  Collect and Photography,473 Detroit Crescent,Ann Arbor,Michigan,48346,605-261-6960,
134,kaam-662-719,Grace's Precede YYello Telemarketing,958 Harmony Path,Rapid City,South Dakota,57422,458-899-1844,Christina.Grace@telemarketing.com
135,938-oud-218,Halbarad's Instruct Secretary Security System Services,917 Armco Crescent,Maryland Heights,Missouri,63531,,Lida.Halbarad@secretarysecuritysystemservices.org
136,6246-laj-8148,Maeglin's Charity Convince and Construction,1224 Clevenger Parkway,Dyersburg,Tennessee,37756,203-106-2140,Natalie.Maeglin@charityconstruction.net
137,dptlg-400-2684,Michaela's Dedicate MMorrin C Janitorial and Cleaning Services,1461 Discovery Boulevard,Westport,Connecticut,6075,480-400-0334,Willie.Michaela@janitorialandcleaningservices.biz
138,slija-385-754,Beregond's SSable  Know and Landscape Services,889 Powell Way,Yuma,Arizona,85077,217-084-9084,Rachel.Beregond@landscapeservices.org
139,8355-hvfjb-9318,Stormcrow's Quote Bath Land Surveying,921 Detroit Ridge,Mokena,Illinois,62817,,Larissa.Stormcrow@bathlandsurveying.org
140,6876-zbx-865,Terry's Decorate Bath Optometry,800 Norfield Ave,Beacon,New York,14898,276-422-4395,Cindy.Terry@bathoptometry.com
141,oplg-391-98271,Palantir's Replacement Weaken and Marketing and Advertising,1229 Holbein Lane,Fort Hunt,Virginia,22305,,Marilyn.Palantir@replacementmarketingandadvertising.us
142,zzqrx-439-6567,Eowyn's Decorate MMorrin C Nail Salon,1368 Parkwood Blvd,Gretna,Louisiana,70159,803-401-1623,Iris.Eowyn@nailsalon.co.uk
143,682-zhrh-935,Ivy's Hurry Idea Crop Production,1679 Mary Run,Myrtle Beach,South Carolina,29810,217-381-0572,Mackenzie.Ivy@ideacropproduction.us
144,29500-syf-464,Kate's Collect Salad Speech and Occupational Therapy,666 Deer Ridge,Skokie,Illinois,61656,479-168-6462,speechandoccupationaltherapy@Katesalad.com
145,346-ysa-678,Beregond's Swing EEternity Oil and Gas Distribution,1661 Dana Rd,Little Rock,Arkansas,72913,479-980-4075,oilandgasdistribution@Beregond.us
146,rklp-450-93557,Wendy's Strengthen TThess Cigarette Manufacturing,432 Ballov Station,Siloam Springs,Arkansas,71659,302-120-6945,Jennifer.Wendy@cigarettemanufacturing.us
147,srux-9575-57715,Earendil's AAdrien Copy and Bank,1516 Zane Court,Wilmington,Delaware,19725,808-021-7901,Dana.Earendil@bank.org
148,58055-fhrj-109,Dori's Fund Profession Home Health Services,972 Hartman Place,K+ä-üne+óGé¼-£ohe,Hawaii,96826,209-359-2089,Cheryl.Dori@professionhomehealthservices.com
149,gahef-3385-864,Emily's Dedicate Throat Mental Health Services,1373 Workman Crescent,San Jacinto,California,91363,228-668-5089,Isaiah.Emily@throatmentalhealthservices.com
150,41488-qmpf-8705,Legolas's Convince MMorrin C Architecture,1053 Beverly Street,Bayonne,New Jersey,8221,401-733-8101,architecture@Legolas.net
151,12168-obk-513,Patricia's Convince ZZillah Massage and Day Spa,1109 Busch Circle,Portsmouth,Rhode Island,2888,458-689-6766,Melissa.Patricia@massageanddayspa.org
152,961-wdoi-438,Brandybuck's Artisan Copy and Land Surveying,1081 Salgarber Run,Raytown,Missouri,65769,218-767-3029,Hanna.Brandybuck@artisanlandsurveying.biz
153,uddvu-601-8300,Miriel's Spring Skill Massage Therapy,1071 Kettering Terrace,Laconia,New Hampshire,3307,212-207-7990,massagetherapy@Mirielskill.com
154,ajvuo-2893-60973,Curufin's Revenue Strengthen and Private Investigator,1770 Ridge Blvd,Seabrook,Maryland,20625,802-976-7417,Randy.Curufin@revenueprivateinvestigator22.biz
155,xta-9267-9747,Willow's Artisan Twist and Auditing,532 Mckaig Court,South Burlington,Vermont,5750,206-718-9218,
156,97579-cqui-925,Gregory's Understand AArc Br Storage,601 Tammy Park,Longview,Washington,98054,423-670-0608,Gabriel.Gregory@storage.com
157,11793-bkkxm-3100,Durin's LLillith  Slam and Publishing Services,722 Applegate Run,Germantown,Tennessee,37110,405-612-1983,publishingservices@Durin.com
158,80757-thogi-4354,Oakenshield's Reputation Twist and Whiskey Manufacturing,637 Denning Rd,Tupelo,Mississippi,38801,,whiskeymanufacturing@Oakenshieldreputation68.biz
159,gckzg-761-690,Glorfindel's ZZayne Cr Serve and Livestock and Slaughtery,1623 Lancaster Court,Calhoun,Georgia,31632,218-399-7200,
160,rwyn-217-71077,Angela's Test WWill Publishing Services,1010 Lubring Ridge,East Concord,New Hampshire,3258,803-215-1232,
161,ownqw-1022-995,Wormtongue's Quote ZZillah Credit Union,1049 Ridge Court,Myrtle Beach,South Carolina,29828,802-486-4636,Ralph.Wormtongue@creditunion.us
162,aks-1729-58725,Eru's Idea Store and Embalmer,427 Ashburton Circle,Colchester,Vermont,5648,303-159-2780,
163,qjuzw-956-45887,Sylvia's Assumption Store and Security System Services,1257 Mundy Square,Clifton,Colorado,81154,207-030-8256,securitysystemservices@Sylviaassumption.org
164,5717-zpmym-5882,Evie's SSable  Protect and Personal Assistant,1065 Mcfarland Crescent,South Portland Gardens,Maine,4983,225-027-5012,Joan.Evie@personalassistant74.us
165,ebw-821-27959,Jacob's Spring MMax M Credit Union,1607 Cranfield Avenue,Laplace,Louisiana,70519,339-975-4235,Vincent.Jacob@creditunion.net
166,lmzdi-523-3414,Lucy's Exceed NNoirax De Pawn Brokers,883 Granville Park,Omaha,Nebraska,68730,215-020-9432,pawnbrokers@Lucy.net
167,548-jgxin-6066,Fili's Flight Fancy and Building Inspection,1312 Muirwood Parkway,Carlisle,Pennsylvania,18360,276-998-2770,Sara.Fili@flightbuildinginspection.co.uk
168,lqsu-207-1233,Shadowfax's Information Release and Technology Services,1562 Stokely Avenue,Fort Hunt,Virginia,23306,319-754-9270,
169,6301-hfdr-6158,Gandalf's Slam Tennis Auto Dealership,1736 Blossom St,Des Moines,Iowa,50241,603-060-8972,autodealership@Gandalftennis.net
170,382-bmqjz-315,Stormcrow's Salad Gasp and Locksmith,829 Village Trail,Medina,Ohio,43535,215-103-9201,
171,mss-2105-23441,Smeagol's Response Dedicate and Beauty Salon,1553 Rose Trail,Reading,Pennsylvania,15451,210-336-2376,Marilyn.Smeagol@responsebeautysalon.co.uk
172,xrsob-465-99721,Lilly's Decorate PPandora  Contracting,1686 Blalock Path,Big Spring,Texas,76162,907-887-0427,
173,uxsem-1371-9808,Mablung's Store Requirement Trade School,1392 Merryhill Terrace,Fairbanks,Alaska,99746,,
174,qqgqy-667-761,Toki's LLuna Chat and Barber Shop,1396 Locksmith Ave,Emporia,Kansas,66282,,
175,gxan-3089-95077,Dorothy's SScarlet Strengthen and Substance Abuse Services,946 Rockville St,,New Mexico,87581,210-973-8322,
176,58196-ysc-6657,Rose's Hospital Protect and Landscape Services,838 Nelson Circle,Fort Worth,Texas,78215,208-229-8396,landscapeservices@Rosehospital.com
177,39415-opp-6722,Alatar's Protect Revenue Event Planning,1351 Tarkman Rd,Coeur d'Alene,Idaho,83303,314-442-2858,Zachary.Alatar@revenueeventplanning.us
178,4574-cgj-301,Shagrat's Tradition Exceed and Florist,1216 Highland Square,,New Mexico,88430,385-341-2081,Maggie.Shagrat@traditionflorist.com
179,7080-xkge-930,Aldarion's Information Dedicate and Agriculture & Forestry and Wildlife Extermination and Pest Control,1093 Nora Ridge,Saint George,Utah,84750,225-661-0802,agriculture&forestryandwildlifeexterminationandpestcontrol@Aldarioninformation.net
180,zvrz-261-77262,Lida's Wood Arrest and Bakery,1025 Cleve Road,Shenandoah,Louisiana,71353,505-134-0521,bakery@Lidawood.co.uk
181,1662-czr-5088,April's Outcome Pay and Chiropractic Office,405 Stone Path,,Oregon,97324,458-727-7133,
182,4277-mxk-3043,Ferny's Look SScarlet Remodeling,1433 Charles Crescent,Saint Joseph,Missouri,65653,303-388-6961,
