Id,Code,Name,Address,City,State,Zip,Phone,Email
362,lejam-176-80896,Christina's Praise AAyda V Landscape Services,1628 Tranquility Way,American Fork,Utah,84325,303-743-3623,Peter.Christina@landscapeservices.us
363,841-qit-6088,Tuor's PPandora  Instruct and Specialty Seafood,777 Burbank Rd,Ca+â-¦on City,Colorado,81010,,
364,6933-gkwf-385,Madison's Replacement Select and Interior Design,1075 Moccasin Court,Culver City,California,95009,,interiordesign@Madisonreplacement.com
365,91738-kzv-5503,Dori's Improve Throat Bank,448 Spratt Ln,Canton,Georgia,30306,808-105-3137,Rachel.Dori@throatbank26.com
366,vwvdr-589-6073,Arwen's Fund Shirt Cash Advances,1268 Philadelphia Lane,Wailuku,Hawaii,96788,206-013-2644,
367,549-mkh-723,Elwing's Praise Secretary Catering,802 Nottinghamshire Parkway,Lakewood,Washington,99027,,Valerie.Elwing@secretarycatering.biz
368,6484-ixgp-8767,Gimli's Strengthen AAsema Funeral Director,542 Sheila Square,Cedar Falls,Iowa,52751,,Paul.Gimli@funeraldirector.co.uk
369,weay-664-33469,Feanor's SScarlet Hurry and Telemarketing,1579 Marion St,Colchester,Vermont,5769,207-250-2228,telemarketing@Feanor.us
370,745-lbmze-867,Melian's TTwilight L Benefit and Catering,890 Benjamin Run,Westbrook,Maine,4686,,catering@Melian.net
371,lxevc-5467-78530,Curufin's Reputation Store and Construction and Utilities,940 Hinman Run,Johnson City,New York,14742,808-791-0380,
372,kmgb-265-7861,Jenny's Reputation Instruct and Oil and Gas Distribution,536 Perdue Circle,Makakilo,Hawaii,96760,,Lilly.Jenny@reputationoilandgasdistribution.biz
373,krufs-641-429,Mablung's NNoirax De Insert and Bank,838 Parry Square,Henderson,Nevada,89028,405-935-2854,
374,24865-nftis-8643,Kathy's Prevent Uncle Embalmer,1023 Blocksom Way,Ridgeland,Mississippi,39150,239-085-7226,
375,410-hwzja-4574,Eomer's GGriffin  Twist and Tax Preparation,450 Denbigh Place,Merritt Island,Florida,33872,231-108-4268,taxpreparation@Eomer.org
376,hxn-449-1579,Galadriel's Target IIlta Dry cleaning and Laundry,1651 Buckingham Drive,Summerlin South,Nevada,89017,308-097-7812,
377,301-xkaa-689,Alatar's Benefit Bath Mortgage Company,1346 Marsha Street,Lenoir,North Carolina,28735,,
378,ipf-8470-8696,Manwe's Insert Artisan Video Production,1408 Arnold Run,Greenwood,Mississippi,39149,339-977-8230,
379,qcu-515-54588,Nori's Pay RRoshia Chr Funeral Director,1040 Sharonwood Street,Lincoln,Nebraska,69022,,Kyle.Nori@funeraldirector.us
380,gnk-161-29988,Jackson's Hospital Fancy and Funeral Director,605 Lincoln St,Newark,Delaware,19945,228-734-5187,Isaiah.Jackson@hospitalhospital.co.uk
381,hrb-440-3700,Gimli's Revenue Know and Property Management,1077 Juanita Crescent,Toms River,New Jersey,7662,209-348-2971,propertymanagement@Gimlirevenue.net
382,bhg-9352-5240,Walter's Understand CCalami Marketing and Advertising,1667 Jessamine Rd,Moreno Valley,California,90703,209-346-5026,Freya.Walter@marketingandadvertising.us
383,oxqht-7328-8826,Fingolfin's Improve Disease Veterinary Medicine,1720 Lock Place,Walnut Park,California,96117,605-423-1797,Brittany.Fingolfin@diseaseveterinarymedicine.org
384,4864-ana-6132,Jaime's Instruct AAshen  Nail Salon,1142 Bolton Crescent,Rapid City,South Dakota,57466,,
385,jjsq-154-2330,Jackson's EElza  Slam and Catering,1685 Juniper Ridge,Lafayette,Louisiana,71477,,Heather.Jackson@catering.co.uk
386,yuffh-483-923,Goldberry's Swing Media Massage Therapy,1376 Holliday Trail,Union City,Georgia,31402,480-042-5221,Kelsey.Goldberry@mediamassagetherapy.us
387,9311-leazo-981,Bombadil's Wood Collect and Mortgage Company,1179 Newport Boulevard,Sahuarita,Arizona,85066,,Janice.Bombadil@woodmortgagecompany.org
388,9731-nwlgp-1046,Bifur's Precede SSybi Insurance,1286 Harmony Drv,Grand Island,Nebraska,68056,307-428-4018,Terry.Bifur@insurance55.net
389,2480-qeh-5542,Nori's Protect Bedroom Interior Design,698 Carver Ridge,Sheridan,Wyoming,83115,,Bailey.Nori@bedroominteriordesign.com
390,ards-652-6521,Elwing's Select Desk Construction and Utilities,1562 Brick Rd,,West Virginia,25969,513-749-3397,Stephen.Elwing@deskconstructionandutilities0.com
391,klel-377-229,Shelob's Uncle Fund and Hotels,1371 Stansberry St,Ham Lake,Minnesota,56536,,
392,hyjbm-457-5056,Robert's Brainstorm SSeraphim  Sports Agency,1452 Kirk St,Hastings,Nebraska,68711,,
393,qbxlr-8194-79392,Stephen's Farmer Target and Tanning Salon,1228 Purvis Heights,Wailuku,Hawaii,96754,240-347-9017,tanningsalon@Stephenfarmer.co.uk
394,84893-iic-8452,Jerry's PPandora  Attach and HVAC Repair,464 Christopher Ave,Great Falls,Montana,59007,,Donna.Jerry@hvacrepair.org
395,xyzd-299-73436,Nazgul's ZZayne Cr Spring and Construction,903 Danville Ave,Norfolk,Nebraska,69360,406-802-3892,
396,cdg-9904-83073,Jacqueline's Pay Reputation Bank,867 Deer Square,Farmingville,New York,10576,702-987-5525,
397,qulu-783-677,Shelob's MMax M Pay and Cemetery,905 Wisteria Path,,North Dakota,58441,339-056-2723,cemetery@Shelob.com
398,nhgn-4663-533,Karen's Decorate LLuce Naxx Car Rental,993 Eastview Ln,Grand Island,Nebraska,68777,316-592-0484,
399,45245-rrzmg-2556,Radagast's Fancy Reputation Security Guard,708 Pleasantville Trail,Topeka,Kansas,66840,803-385-5244,securityguard@Radagastreputation.org
400,10973-thzt-7740,Jason's SScarlet Understand and Medical Office,939 King Boulevard,Hanahan,South Carolina,29720,217-043-5579,medicaloffice@Jason.biz
401,81646-tllug-5539,Bombur's Shirt Exceed and Radiology,1220 Homeless Ridge,Highland Park,Illinois,62567,219-668-5418,Kelsey.Bombur@shirtradiology.org
402,nazaf-287-72810,Lydia's Weaken AArc Br Tax Preparation,1554 Garfield Court,Michigan City,Indiana,47970,702-252-7607,
403,1723-xuwzv-6773,Erin's Insert ZZayne Cr Land Surveying,907 Glenn Ln,,North Dakota,58520,,
404,4428-uom-2110,Thranduil's GGriffin  Agree and Investing,960 Jewett Station,Webster Groves,Missouri,64726,480-089-5104,investing@Thranduil.org
405,469-ghsbh-417,Orome's QQuistis G Collect and Emergency Medical Services,457 Chapman Square,Maricopa,Arizona,85087,808-319-8220,emergencymedicalservices@Orome.com
406,bxno-4612-710,Sandra's Information Store and Agriculture & Forestry and Wildlife Extermination and Pest Control,1723 Solida Drv,Makakilo City,Hawaii,96819,,agriculture&forestryandwildlifeexterminationandpestcontrol@Sandrainformation.net
407,feg-777-62621,The White's Insert Wood Travel Agency,425 Alvin Parkway,City of Milford (balance),Connecticut,6920,210-062-6204,
408,933-yte-580,Harold's AAgnes  Twist and Florist,837 Dixie Place,Fort Hood,Texas,79907,,
409,arm-661-3672,Gildor's YYello Improve and Real Estate Agency,1802 Beechmont Heights,Thousand Oaks,California,92863,,realestateagency@Gildorestate.net
410,sae-706-2961,Jack's RRoshia Chr Twist and Specialty Fruit,1599 Durban Court,Menomonie,Wisconsin,54936,603-821-6473,Jewel.Jack@specialtyfruit.us
411,6510-wptd-6523,Wayne's Select SScarlet Florist,531 Cleve Ln,Ashtabula,Ohio,45482,513-526-3331,Ophelia.Wayne@florist.com
412,9148-srjon-363,Anthony's Travel QQuistis G Cash Advances,1304 Orders Boulevard,Edina,Minnesota,55468,603-728-5581,cashadvances@Anthony85.co.uk
413,43027-tlv-5883,Erik's Improve SSybi Interior Design,486 Gratiot-Newark Rd,Steubenville,Ohio,45739,859-705-5151,interiordesign@Erik40.biz
414,rtzru-688-1467,Eru's Strengthen WWeiss M HVAC Repair,748 Public Drv,Covington,Kentucky,40118,,Sage.Eru@hvacrepair.co.uk
415,rft-980-67007,Proudfoot's Benefit Disease Towing,1581 Inwood Ln,South Burlington,Vermont,5053,239-380-6174,towing@Proudfootdisease.net
416,501-kym-441,Russell's Select Reality Casino,656 Cranfield Ave,Miami Lakes,Florida,33597,225-444-2346,Lilly.Russell@realitycasino67.org
417,jic-9321-6419,Alatar's Select TTwilight L Tax Preparation,992 Sheandoah Square,Gretna,Louisiana,70895,316-714-3974,
418,8511-qdihy-2650,Linda's Weaken WWeiss M Mental Health Services,573 Catalpa Heights,Leavenworth,Kansas,67547,262-516-4281,Lauren.Linda@mentalhealthservices.co.uk
419,jnkjb-7158-6410,Gildor's Decorate Permission Tanning Salon,1664 Rosewood Ridge,Beloit,Wisconsin,53109,201-982-5043,tanningsalon@Gildorpermission.com
420,72989-lwuy-9891,Valaquenta's Fund PPandora  Residential Care Facility,831 Jefferson Boulevard,Stillwater,Oklahoma,73105,206-059-4718,residentialcarefacility@Valaquenta.com
421,298-zrpn-368,Shirley's Exceed Charity Hotels,560 Garrell Lane,Federal Way,Washington,98505,,hotels@Shirleycharity.biz
422,ywxrm-7499-21142,Yavanna's Improve MMemory Ad Radiology,944 Sundale Road,Wilson,North Carolina,27892,210-740-1941,radiology@Yavanna49.com
423,2332-dbf-4908,Theoden's Weakness Precede and Food and Hospitality,1046 Eldwood Road,Alamo,Texas,75637,,foodandhospitality@Theodenweakness.net
424,50966-rmxz-2886,Alyssa's Attach EElaine Sha Concrete Manufacturing,1423 Brandywine Trail,Anchorage,Alaska,99824,201-152-1419,concretemanufacturing@Alyssa.org
425,mztk-251-376,Dale's AArlin Fund and Travel Agency,1075 Nora Station,Oklahoma City,Oklahoma,73108,225-074-7686,Jonathan.Dale@travelagency.org
426,mlqvj-9202-7776,Shadowfax's Media Twist and Cemetery,1452 Roemer Drive,Chalmette,Louisiana,70064,603-985-1045,cemetery@Shadowfaxmedia.org
427,dcj-4003-29684,Ulmo's People Quote and Cosmetology School,1215 Orton Street,Springboro,Ohio,44633,240-559-7788,Lara.Ulmo@peoplecosmetologyschool.us
428,tnsbf-3998-8441,Annabelle's Gasp SSybi Publishing Services,1111 Clay Terrace,Helena,Montana,59714,605-985-4293,Melody.Annabelle@publishingservices.biz
429,mihc-4256-89099,Kementari's Arrest Diamond Tutoring Services,1629 Putnam Blvd,Mitchell,South Dakota,57551,218-229-0629,
430,kszb-6293-700,Bregolas's Philosophy Insert and Specialty Meat,1772 Ellis Path,Salem,New Hampshire,3282,,specialtymeat@Bregolasphilosophy.com
431,8761-dwu-4368,Rose's Fancy Charity Event Planning,476 Hunter Drive,North Little Rock,Arkansas,72703,859-300-9995,
432,13895-tqr-721,Ellie's Brainstorm Engine Taxi,512 Jenkins Path,Lexington-Fayette,Kentucky,40150,209-902-8824,Logan.Ellie@enginetaxi.com
433,6509-phy-7807,Ulmo's Engine Twist and Bank,1701 Smithwood Lane,Napa,California,92117,302-581-6606,bank@Ulmoengine.co.uk
434,ybl-366-27687,Betty's Collect Tennis Residential Care Facility,1175 Ryan Lane,Wilmington,Delaware,19894,,
435,94297-luf-681,Baggins's Protect HHazelmer Alcohol and Tobacco Sales,1151 Schneider Ridge,Fort Hunt,Virginia,23140,308-805-8643,Crystal.Baggins@alcoholandtobaccosales32.co.uk
436,10871-rga-970,Gothmog's Profession Target and Storage,788 Hendershot Boulevard,Indian Trail,North Carolina,28775,252-576-3460,storage@Gothmogprofession.us
437,gygfj-874-83248,Beren's Praise AAyda V Cigarette Manufacturing,809 Arch Parkway,Palmer,Massachusetts,1930,302-906-8386,cigarettemanufacturing@Beren.us
438,akg-5912-53323,Palantir's MMorrin C Develop and Photography,1697 Idaho Blvd,Newark,Delaware,19964,316-483-7026,Veronica.Palantir@photography.co.uk
439,9753-nwdvg-1995,Megan's Suffer CCalami Personal Assistant,1137 Owens Blvd,Pittsburg,Kansas,67621,385-374-6462,
440,665-hrvzs-4961,Emily's AAgnes  Exceed and Substance Abuse Services,1506 Wells Avenue,East Millcreek,Utah,84540,907-050-9469,substanceabuseservices@Emily.com
441,mdd-503-49589,Bombur's NNoirax De Agree and Building Inspection,494 Federal Circle,Badger,Alaska,99821,401-504-9437,buildinginspection@Bombur.biz
442,wgp-726-895,Clarissa's Chat MMemory Ad Construction and Utilities,1712 Edwards Place,Smithfield,Rhode Island,2901,423-852-5762,Samantha.Clarissa@constructionandutilities82.org
443,bnv-6624-91470,Nienna's Slam Charity Car Rental,1249 Freedom Drv,Tullahoma,Tennessee,37930,304-642-3322,Wayne.Nienna@charitycarrental.biz
444,hica-5582-490,Brianna's EEternity Receive and Cosmetology School,1614 Goddard Place,,West Virginia,24854,385-312-7131,Alexander.Brianna@cosmetologyschool6.us
445,aifs-6191-679,Illuvatar's Precede People Lawn care Services,1220 Raintree Avenue,Salt Lake City,Utah,84631,480-409-7393,lawncareservices@Illuvatarpeople.biz
446,208-luhs-6106,Mark's Develop Profession Concrete Manufacturing,1033 Martin Court,Prescott Valley,Arizona,86535,,
447,aftt-4532-185,Thranduil's Climate Attach and Bakery,1581 Stansberry Way,Wahiaw+ä-ü,Hawaii,96788,302-280-4103,bakery@Thranduilclimate.net
448,ocy-9535-940,Bifur's EElza  Step and Speech and Occupational Therapy,1335 Lashley Ln,Newark,Delaware,19809,,speechandoccupationaltherapy@Bifur.net
449,606-wfs-600,Sandra's Information Develop and Emergency Medical Services,1169 Grieves Path,Salisbury,North Carolina,27233,307-248-8070,emergencymedicalservices@Sandrainformation.biz
450,gmvt-3505-490,Gamgee's ZZillah Prevent and Vocational Rehabilitation,1344 Market Street,Gillette,Wyoming,82214,,vocationalrehabilitation@Gamgee27.org
451,geo-9507-133,Anarion's Select Death Auditing,791 Browns Court,Wilmington,Delaware,19961,405-542-6294,
452,4472-amm-517,Thingol's Quote AArlin Accounting,960 Stiers Run,Gautier,Mississippi,38669,201-500-6808,
453,unnxz-2637-90599,Faramir's Desk Suffer and Repair and Maintenance,468 Potts Street,Mustang,Oklahoma,74425,228-056-5820,repairandmaintenance@Faramirdesk.co.uk
454,pjdgo-876-31309,Shagrat's WWill Decorate and Auto Dealership,1556 Merriam Terrace,West Milford,New Jersey,8857,209-786-7712,autodealership@Shagrat.biz
455,hqr-3515-5835,Shirley's Quote GGriffin  Used Car Sales,572 Navy Avenue,Ukiah,California,94294,316-655-5053,usedcarsales@Shirley.net
456,zyw-9737-768,Crystal's Bedroom Collect and Electrolysis,1161 Bellwood Ave,Hays,Kansas,66873,208-228-0432,electrolysis@Crystalbedroom.net
457,52543-kkhq-9386,Megan's TTwilight L Form and Specialty Seafood,1451 Washington Avenue,Meridian,Idaho,83847,203-530-1161,specialtyseafood@Megan.biz
458,281-acoi-3488,Angrod's LLillith  Slam and Agriculture & Forestry and Wildlife Extermination and Pest Control,1803 Pierce Drive,Wethersfield,Connecticut,6443,228-152-7111,
459,ccjc-2633-98419,Nicole's EElaine Sha Arrest and Oil and Gas Distribution,613 Harbor Path,Carteret,New Jersey,8823,231-896-0463,oilandgasdistribution@Nicole.co.uk
460,368-htv-4553,Aldarion's Spring AAsema Collection Agency,708 Palomino Rd,Spanish Springs,Nevada,89521,276-046-5179,
461,dqaxb-364-28002,Lurtz's Decorate GGail Pa Record Business,1621 Carpenter Street,Fort Hunt,Virginia,24319,206-392-6384,Christian.Lurtz@recordbusiness.co.uk
462,81672-ybw-498,Joy's Fancy Information Mental Health Services,998 Ellen Lane,Fairwood,Washington,98263,303-491-7473,mentalhealthservices@Joyinformation.us
463,7727-ewtd-2404,Ulmo's Agree TThess Property Management,1681 Lent Street,Northglenn,Colorado,80161,,
464,63945-ocy-492,Felagund's Beer Instruct and Real Estate Agency,794 Beam Place,,North Dakota,58362,907-477-7119,Katie.Felagund@beerrealestateagency.biz
465,gftj-973-15972,Victoria's Pay Assumption Cosmetology School,1578 Venture Avenue,Fairbanks,Alaska,99723,405-052-2241,Amber.Victoria@assumptioncosmetologyschool.co.uk
466,5996-nwm-3903,Pamela's Test GGriffin  Technical School,444 Circleville Crescent,Columbus,Mississippi,39754,,Lucy.Pamela@technicalschool.net
467,9362-beg-887,Mitch's Twist Profession Photography,1781 Bolen St,Woodlawn,Maryland,21093,217-236-2596,
468,90223-lihe-591,Claudia's Replacement Pay and Auto Dealership,1015 Darla Ridge,Quincy,Illinois,62673,231-113-0530,Daniella.Claudia@replacementautodealership70.net
469,gfhmt-795-33290,Gamgee's Store Wife Massage Therapy,1551 Mccaslin Ave,Sunrise Manor,Nevada,89823,,
470,bjgcg-3999-8877,Jennifer's Farmer Suffer and Veterinary Medicine,1540 Denning Rd,,West Virginia,25123,803-087-1970,veterinarymedicine@Jenniferfarmer.biz
471,ycuc-351-62203,Daniel's Philosophy Spring and Security Guard,943 Austin Square,Greenwood,South Carolina,29323,513-034-8875,securityguard@Danielphilosophy.co.uk
472,idjxh-721-880,Jennifer's EEternity Suffer and Emergency Medical Services,997 Waldolf Rd,Duluth,Minnesota,56520,208-903-5478,emergencymedicalservices@Jennifer.org
473,zjvss-6245-19714,The White's Target Charity Crop Production,577 Gaslight Ave,Twin Falls,Idaho,83726,316-400-6455,Mark.The White@charitycropproduction.org
474,nou-810-387,Earendil's Climate Quote and Architecture,620 Harrison Ln,Emporia,Kansas,66208,240-351-8512,architecture@Earendilclimate26.co.uk
475,5592-stdpu-413,Ryan's Question Poetry Bookkeeping,425 Wise Place,Bozeman,Montana,59454,,William.Ryan@poetrybookkeeping.com
476,977-uhc-2555,Erestor's AAnnalle Quote and Truck Transportation,1769 Hampton Path,,West Virginia,26104,225-129-1648,Lawrence.Erestor@trucktransportation.us
477,sye-688-55846,Ecthelion's JJinx Test and Hotels,1713 Tedrick Drive,Slidell,Louisiana,70884,385-212-9148,hotels@Ecthelion.org
478,epvm-8723-1265,Proudfoot's Release Uncle GED Certification,1699 Devin Heights,Millcreek,Utah,84313,,
479,ampj-1089-7100,Kathleen's Protect Reality Sports Agency,1538 Brick Ln,Little Rock,Arkansas,72464,458-413-0206,Jerry.Kathleen@realitysportsagency87.net
480,oae-452-443,The Grey's Target EEternity Plumbing,1520 Julian Boulevard,Independence,Missouri,65565,,Lucy.The Grey@plumbing.net
481,819-zvq-4999,Legolas's Topic Attach and Alcohol and Tobacco Sales,622 Uneeda Crescent,Windham,Connecticut,6534,262-769-9636,alcoholandtobaccosales@Legolastopic.co.uk
482,114-pbpcf-252,Erik's GGail Pa Suffer and Interior Design,907 Chesterfield Ridge,Wausau,Wisconsin,54156,316-147-7277,Alexa.Erik@interiordesign.co.uk
483,841-mittp-5311,Grahame's Praise Disease Tutoring Services,1535 Leon Station,Gardner,Kansas,66007,339-645-1950,Jessie.Grahame@diseasetutoringservices.co.uk
484,lmx-446-39058,The Brown's Agree MMargo Veterinary Medicine,1088 Lafayette St,Lincoln,Nebraska,68925,605-184-7051,veterinarymedicine@The Brown.co.uk
485,9197-vhr-2507,Gandalf's Bath Benefit and Racetrack,424 Beechcreek Court,Sioux Falls,South Dakota,57046,,Albert.Gandalf@bathracetrack.org
486,520-syscy-778,Elentari's AArc Br Select and Landscape Services,722 Richey Crescent,Richfield,Minnesota,56044,,Rachel.Elentari@landscapeservices.us
487,620-uufs-183,Orodreth's Skill Serve and Event Planning,462 Babbs Lane,Drexel Heights,Arizona,85623,405-778-7483,Lilly.Orodreth@skilleventplanning.net
488,iaby-6390-2014,Yvette's Tension Hurry and Livestock and Slaughtery,1627 Penn Rd,Jackson,Mississippi,38776,,livestockandslaughtery@Yvettetension.com
489,tti-250-2667,Donna's Twist Entertainment Grocery,1263 Eastern Ln,Gary,Indiana,46515,513-931-9093,grocery@Donnaentertainment.org
490,eody-836-5417,Bruce's EElza  Store and Construction,938 Royalton Blvd,White Bear Lake,Minnesota,55377,,James.Bruce@construction.co.uk
491,solxr-659-44651,Alcarin's Hurry SSable  Land Surveying,426 Mcarthur Avenue,,West Virginia,26542,,landsurveying@Alcarin.com
492,1350-buh-7581,Kayla's Revenue Understand and Event Planning,1198 Basil Park,Kalispell,Montana,59450,203-437-7044,
493,409-hluba-8988,Butterbur's Develop JJillia Sha Bail Bonds,1067 Foxfire Way,Westport,Connecticut,6095,302-686-6807,bailbonds@Butterbur.net
494,8527-hoi-578,Baggins's Twist Assumption Optometry,1116 Flintridge Road,Dover,Delaware,19884,303-010-7255,Elijah.Baggins@assumptionoptometry.co.uk
495,80017-gkaiv-263,Eowyn's Judge JJinx Dentistry,927 Brookside Terrace,Ca+â-¦on City,Colorado,81428,405-151-0165,Sydney.Eowyn@dentistry.biz
496,8735-ycbao-968,Radagast's WWish  Confess and Nail Salon,1595 Redondo Place,Gulfport,Mississippi,39441,209-076-9860,
497,5277-bojm-2051,Cotton's Impress Replacement Tutoring Services,1314 Eddie Drive,Redondo Beach,California,95687,,tutoringservices@Cottonreplacement.biz
498,frcpn-6565-90084,Khamul's Spring AAshen  Storage,1135 Rains Trail,Shawnee,Kansas,67418,802-044-8285,Dennis.Khamul@storage.com
499,isn-8216-39236,Faramir's IIlta Chat and Chiropractic Office,482 Tridelphia Park,Colchester,Vermont,5481,,Jenny.Faramir@chiropracticoffice.co.uk
